{
  "schema_version": 1,
  "solver": "calculix",
  "version": "2.23",
  "case_id": "cantilever_smoke",
  "dofs": 48,
  "wall_time_s": {
    "mesh": null,
    "solve": 0.030549247996532358,
    "total": 0.030549247996532358
  },
  "accuracy": {
    "name": "smoke_ran",
    "value": 1.0,
    "unit": "bool"
  },
  "label": "calculix-cantilever-smoke",
  "timestamp": "2026-07-10T08:54:04.391282+00:00",
  "notes": "ccx C3D8 4x1x1 smoke deck (20 nodes, 48 free DOF); not a calibrated accuracy benchmark vs PolyMesh tip err"
}
